{
    "id": "hk",
    "apiVersion": 1,
    "cover": "cover.png",
    "worldObjectGuards": [
        { "actingType": "soulStatus", "section": "Map", "name": "Soul Status" },
        { "appearanceType": "soulStatue", "section": "Map", "name": "Soul Statue" }
    ],
    "editorFeatures": {
        "showSoulActingOnBlocks": true,
        "showSoulStatueOnObstacles": true,
        "showSoulStatueOnKoreen": true
    },
    "name": "Hollow Knight",
    "version": "1.0.36",
    "description": "Adds Hollow Knight-style mechanics: Soul system, nail attacks, Monarch Wings (double jump), Mantis Claw (wall cling & wall jump), Mothwing Cloak (dash), Crystal Heart (super dash), and Focus healing.",
    "author": "Parkoreen",
    "color": "#667eea",
    "coverHeight": 120,
    "dependencies": ["cj", "hp"],
    "scripts": {
        "globals": "js/globals.js",
        "inject": "js/inject.js",
        "script": "js/script.js"
    },
    "sounds": {
        "dash": "mp3/dash.mp3",
        "monarchWings": "mp3/monarch-wings.mp3",
        "healCharging": "mp3/heal-charging.mp3",
        "healComplete": "mp3/heal-complete.mp3",
        "hitSoulStatus": "mp3/hit-soul-status.mp3",
        "superdashCharge1": "mp3/superdash-charge1.mp3",
        "superdashCharge2": "mp3/superdash-charge2.mp3",
        "superdashBurst": "mp3/superdash-burst.mp3",
        "superdashFlying": "mp3/superdash-flying-loop.mp3",
        "superdashHitwallstop": "mp3/superdash-hitwallstop.mp3",
        "superdashTriggerstop": "mp3/superdash-triggerstop.mp3",
        "getSoul": ["mp3/get-soul1.mp3", "mp3/get-soul2.mp3", "mp3/get-soul3.mp3", "mp3/get-soul4.mp3", "mp3/get-soul5.mp3", "mp3/get-soul6.mp3", "mp3/get-soul7.mp3"]
    },
    "config": {
        "defaultGravity": {
            "type": "number",
            "label": "Default Gravity",
            "description": "HK-style gravity (0.71 = 70% jump height)",
            "default": 0.71,
            "min": 0.1,
            "max": 2
        },
        "maxSoul": {
            "type": "number",
            "label": "Max Soul",
            "description": "33 = one heal, 99 = three heals",
            "default": 99,
            "min": 33,
            "max": 198
        },
        "pogoBouncePower": {
            "type": "number",
            "label": "Pogo Bounce Strength",
            "description": "Upward strength after a downward nail hit, relative to normal jump force. 0.71 reaches about half the maximum jump height.",
            "default": 0.71,
            "min": 0.5,
            "max": 0.71
        },
        "monarchWing": {
            "type": "boolean",
            "label": "Monarch Wings",
            "description": "Double jump ability",
            "default": false
        },
        "monarchWingAmount": {
            "type": "number",
            "label": "Monarch Wing Amount",
            "default": 1,
            "min": 1,
            "max": 99,
            "showIf": "monarchWing"
        },
        "monarchWingJumpPower": {
            "type": "number",
            "label": "Monarch Wing Jump Strength",
            "description": "Double-jump upward force as a fraction of the map's normal jump force.",
            "default": 0.85,
            "min": 0.5,
            "max": 2,
            "showIf": "monarchWing"
        },
        "dash": {
            "type": "boolean",
            "label": "Mothwing Cloak (Dash)",
            "description": "Press comma (,) to dash",
            "default": false
        },
        "superDash": {
            "type": "boolean",
            "label": "Crystal Heart (Super Dash)",
            "description": "Hold period (.) to charge",
            "default": false
        },
        "mantisClaw": {
            "type": "boolean",
            "label": "Mantis Claw (Wall Jump)",
            "description": "Cling to walls and wall jump",
            "default": false  
        },
        "nailSpeed": {
            "type": "select",
            "label": "Nail Attack Speed",
            "description": "Base: 0.41s between attacks. Quick Slash: 0.25s between attacks.",
            "default": "base",
            "options": [
                { "value": "base", "label": "Base (0.41s)" },
                { "value": "quickSlash", "label": "Quick Slash (0.25s)" }
            ]
        },
        "slashEffects": {
            "type": "boolean",
            "label": "Nail Slash Effects",
            "description": "Draw the animated slash arc during attacks.",
            "default": true
        },
        "impactEffects": {
            "type": "boolean",
            "label": "Impact and Landing Effects",
            "description": "Draw nail-hit sparks, damage flashes, landing dust, and Soul motes released by Soul Statues.",
            "default": true
        },
        "cameraShakeEffects": {
            "type": "boolean",
            "label": "Camera Impact Effects",
            "description": "Add a short camera shake for nail hits, landings, and Super Dash wall impacts.",
            "default": true
        },
        "impactShakeIntensity": {
            "type": "number",
            "label": "Hit Shake Strength",
            "description": "Maximum screen-pixel shake for nail hits and Super Dash wall impacts. Set to 0 to disable hit shake.",
            "default": 7,
            "min": 0,
            "max": 18
        },
        "landingShakeIntensity": {
            "type": "number",
            "label": "Landing Shake Strength",
            "description": "Maximum screen-pixel shake for landings. Set to 0 for softer landings.",
            "default": 2,
            "min": 0,
            "max": 8
        },
        "dashTrailEffects": {
            "type": "boolean",
            "label": "Dash Trails",
            "description": "Draw afterimages while dashing and super dashing.",
            "default": true
        },
        "abilityAuraEffects": {
            "type": "boolean",
            "label": "Charge and Focus Auras",
            "description": "Draw progress auras while charging Super Dash and healing.",
            "default": true
        },
        "nailEffectColor": {
            "type": "string",
            "label": "Nail Effect Color",
            "description": "Hex color used by slash and nail impact effects.",
            "default": "#e9fbff"
        },
        "dashEffectColor": {
            "type": "string",
            "label": "Dash Trail Color",
            "description": "Hex color used by dash afterimages.",
            "default": "#9cecff"
        },
        "chargeEffectColor": {
            "type": "string",
            "label": "Super Dash Charge Color",
            "description": "Hex color used by the Super Dash charge aura.",
            "default": "#9cecff"
        },
        "healEffectColor": {
            "type": "string",
            "label": "Focus Aura Color",
            "description": "Hex color used by the Focus healing aura.",
            "default": "#79f2cf"
        }
    },
    "controls": {
        "attack": { "key": "KeyX", "label": "Attack", "description": "+ ↑/↓ for direction" },
        "dash": { "key": "Comma", "label": "Dash" },
        "superDash": { "key": "Period", "label": "Super Dash (hold)" },
        "heal": { "key": "KeyF", "label": "Focus/Heal (hold)" }
    }
}
