{
    "id": "hp",
    "apiVersion": 1,
    "cover": "cover.png",
    "scripts": {
        "globals": "js/globals.js",
        "inject": "js/inject.js",
        "editorUi": "js/editor-ui.js"
    },
    "name": "HP (Health Points)",
    "version": "1.0.4",
    "description": "Adds a health system to the game. Players start with configurable HP. Touching spikes removes 1 HP and teleports player to the last safe ground they stood on.",
    "author": "Parkoreen",
    "icon": "❤️",
    "color": "#FF6B6B",
    "coverHeight": 120,
    "dependencies": [],
    "config": {
        "defaultHP": {
            "type": "number",
            "label": "Default HP",
            "description": "Starting health points for players",
            "default": 3,
            "min": 1,
            "max": 99
        }
    }
}
